<?xml version="1.0" encoding="UTF-8"?>

<!DOCTYPE channel-definition SYSTEM "channelDefinition.dtd">

<!--
 | This channel publishing fragment defines a channel for the
 | Render Count portlet, an example JSR-168 that exercises the
 | dynamic portlet title feature. 
 +-->
 
<channel-definition>

    <title>Render Count Portlet</title>
    <name>Render Count Portlet</name>
    <fname>render-count-portlet</fname>
    <desc>Demonstrates dynamic portlet titles.</desc>
    <type>Portlet</type>
    <class>org.jasig.portal.channels.portlet.CPortletAdapter</class>
    <timeout>60000</timeout>
    
    <hasedit>N</hasedit>
    <hashelp>N</hashelp>
    <hasabout>N</hasabout>

    <secure>N</secure>
    <locale>en_US</locale>
    
    <categories>
        <category>Development</category>
    </categories>
    
    <groups>
        <group>Everyone</group>
    </groups>
    
    <parameters>

        <!-- The syntax of the ID is [portlet-context-name].[portlet-name] -->
        <parameter>
            <name>portletDefinitionId</name>
            <value>RenderCountPortlet.RenderCount</value>
            <description>Identifies the portlet deployed within the portlet container</description>
            <ovrd>N</ovrd>
        </parameter>
        
    </parameters>
    
</channel-definition>
